{
  "schema_version": "curve.provider-credential-reference/v1-candidate",
  "workspace_id": "11111111-1111-4111-8111-111111111111",
  "provider_connection_id": "22222222-2222-4222-8222-222222222222",
  "profile_version": 1,
  "reference_kind": null,
  "reference_format_version": null,
  "status": "UNCONFIGURED",
  "rotation_due_at": null,
  "revoked_at": null,
  "credential_material_present": false
}
